# name: test/sql/quack/partial_file_count.test
# description: Partially visible data and deletion files cannot supply exact count statistics
# group: [quack]

require ducklake

require parquet

require-env DUCKLAKE_CONNECTION

require quack

test-env DATA_PATH {TEST_DIR}

statement ok
ATTACH 'ducklake:{DUCKLAKE_CONNECTION}' AS x (DATA_PATH '{DATA_PATH}/quack_partial_file_count', DATA_INLINING_ROW_LIMIT 2)

statement ok
CREATE TABLE x.data_t(id INTEGER, p INTEGER)

statement ok
ALTER TABLE x.data_t SET PARTITIONED BY (p)

statement ok
CALL x.set_option('data_inlining_row_limit', 0)

statement ok
INSERT INTO x.data_t VALUES (1,1)

statement ok con1
BEGIN

query I con1
SELECT id FROM x.data_t
----
1

statement ok
INSERT INTO x.data_t VALUES (2,1)

statement ok
CALL ducklake_merge_adjacent_files('x')

query I con1
SELECT count(*) FROM x.data_t
----
1

statement ok con1
ROLLBACK

statement ok
CALL x.set_option('data_inlining_row_limit', 2)

statement ok
CREATE TABLE x.del_t(id INTEGER)

statement ok
INSERT INTO x.del_t VALUES (1),(2),(3),(4)

statement ok
DELETE FROM x.del_t WHERE id=1

statement ok con1
BEGIN

query I con1
SELECT id FROM x.del_t ORDER BY id
----
2
3
4

statement ok
DELETE FROM x.del_t WHERE id=2

statement ok
CALL ducklake_flush_inlined_data('x')

query I con1
SELECT count(*) FROM x.del_t
----
3

statement ok con1
ROLLBACK
