# name: test/sql/compaction/compaction_table_stats.test
# description: compaction rewrites keep ducklake_table_stats row and byte counts in sync
# group: [compaction]

require ducklake

require parquet

test-env DUCKLAKE_CONNECTION {TEST_DIR}/{UUID}.db

test-env DATA_PATH {TEST_DIR}

statement ok
ATTACH 'ducklake:{DUCKLAKE_CONNECTION}' AS ducklake (
    DATA_PATH '{DATA_PATH}/compaction_table_stats',
    DATA_INLINING_ROW_LIMIT 0,
    METADATA_CATALOG 'ducklake_meta'
)

statement ok
USE ducklake

statement ok
CREATE TABLE rewrite_delete_stats(i INTEGER);

statement ok
SET VARIABLE rewrite_delete_stats_table_id = (
    SELECT table_id
    FROM ducklake_meta.ducklake_table
    WHERE table_name = 'rewrite_delete_stats'
)

statement ok
INSERT INTO rewrite_delete_stats SELECT i::INTEGER FROM range(100) t(i);

statement ok
DELETE FROM rewrite_delete_stats WHERE i < 10;

query I
SELECT record_count
FROM ducklake_meta.ducklake_table_stats
WHERE table_id = getvariable('rewrite_delete_stats_table_id');
----
100

query I
SELECT COALESCE(SUM(record_count), 0)::BIGINT
FROM ducklake_meta.ducklake_data_file
WHERE table_id = getvariable('rewrite_delete_stats_table_id')
  AND end_snapshot IS NULL;
----
100

query I
SELECT COALESCE(SUM(delete_count), 0)::BIGINT
FROM ducklake_meta.ducklake_delete_file
WHERE table_id = getvariable('rewrite_delete_stats_table_id')
  AND end_snapshot IS NULL;
----
10

query I
SELECT COUNT(*) FROM rewrite_delete_stats;
----
90

query TII
SELECT table_name, files_processed, files_created
FROM ducklake_rewrite_data_files('ducklake', 'rewrite_delete_stats', delete_threshold => 0);
----
rewrite_delete_stats	1	1

query I
SELECT record_count
FROM ducklake_meta.ducklake_table_stats
WHERE table_id = getvariable('rewrite_delete_stats_table_id');
----
90

query I
SELECT COALESCE(SUM(record_count), 0)::BIGINT
FROM ducklake_meta.ducklake_data_file
WHERE table_id = getvariable('rewrite_delete_stats_table_id')
  AND end_snapshot IS NULL;
----
90

query I
SELECT COALESCE(SUM(delete_count), 0)::BIGINT
FROM ducklake_meta.ducklake_delete_file
WHERE table_id = getvariable('rewrite_delete_stats_table_id')
  AND end_snapshot IS NULL;
----
0

statement ok
SET VARIABLE rewrite_delete_stats_size = (
    SELECT file_size_bytes
    FROM ducklake_meta.ducklake_table_stats
    WHERE table_id = getvariable('rewrite_delete_stats_table_id')
)

query I
SELECT (COALESCE(SUM(file_size_bytes), 0)::BIGINT = getvariable('rewrite_delete_stats_size'))::INTEGER
FROM ducklake_meta.ducklake_data_file
WHERE table_id = getvariable('rewrite_delete_stats_table_id')
  AND end_snapshot IS NULL;
----
1

query I
SELECT COUNT(*) FROM rewrite_delete_stats;
----
90

statement ok
CALL ducklake_set_option('ducklake', 'target_file_size', '1MB');

statement ok
CREATE TABLE merge_adjacent_stats(i INTEGER, payload VARCHAR);

statement ok
SET VARIABLE merge_adjacent_stats_table_id = (
    SELECT table_id
    FROM ducklake_meta.ducklake_table
    WHERE table_name = 'merge_adjacent_stats'
)

statement ok
INSERT INTO merge_adjacent_stats SELECT i::INTEGER, repeat('a', 100) FROM range(100) t(i);

statement ok
INSERT INTO merge_adjacent_stats SELECT (i + 100)::INTEGER, repeat('b', 100) FROM range(100) t(i);

statement ok
INSERT INTO merge_adjacent_stats SELECT (i + 200)::INTEGER, repeat('c', 100) FROM range(100) t(i);

query TII
SELECT table_name, files_processed, files_created
FROM ducklake_merge_adjacent_files('ducklake', 'merge_adjacent_stats');
----
merge_adjacent_stats	3	1

query I
SELECT record_count
FROM ducklake_meta.ducklake_table_stats
WHERE table_id = getvariable('merge_adjacent_stats_table_id');
----
300

query I
SELECT COALESCE(SUM(record_count), 0)::BIGINT
FROM ducklake_meta.ducklake_data_file
WHERE table_id = getvariable('merge_adjacent_stats_table_id')
  AND end_snapshot IS NULL;
----
300

statement ok
SET VARIABLE merge_adjacent_stats_size = (
    SELECT file_size_bytes
    FROM ducklake_meta.ducklake_table_stats
    WHERE table_id = getvariable('merge_adjacent_stats_table_id')
)

query I
SELECT (COALESCE(SUM(file_size_bytes), 0)::BIGINT = getvariable('merge_adjacent_stats_size'))::INTEGER
FROM ducklake_meta.ducklake_data_file
WHERE table_id = getvariable('merge_adjacent_stats_table_id')
  AND end_snapshot IS NULL;
----
1

query I
SELECT COUNT(*) FROM merge_adjacent_stats;
----
300

statement ok
USE memory;

statement ok
DETACH ducklake;

statement ok
ATTACH 'ducklake:{DUCKLAKE_CONNECTION}_inline' AS ducklake (
    DATA_PATH '{DATA_PATH}/compaction_table_stats_inline',
    DATA_INLINING_ROW_LIMIT 100,
    METADATA_CATALOG 'ducklake_meta'
)

statement ok
USE ducklake

statement ok
CREATE TABLE rewrite_inlined_delete_stats AS SELECT i::INTEGER AS i FROM range(101) t(i);

statement ok
SET VARIABLE rewrite_inlined_delete_stats_table_id = (
    SELECT table_id
    FROM ducklake_meta.ducklake_table
    WHERE table_name = 'rewrite_inlined_delete_stats'
)

statement ok
DELETE FROM rewrite_inlined_delete_stats WHERE i = 25;

query I
SELECT record_count
FROM ducklake_meta.ducklake_table_stats
WHERE table_id = getvariable('rewrite_inlined_delete_stats_table_id');
----
101

query I
SELECT COALESCE(SUM(record_count), 0)::BIGINT
FROM ducklake_meta.ducklake_data_file
WHERE table_id = getvariable('rewrite_inlined_delete_stats_table_id')
  AND end_snapshot IS NULL;
----
101

query I
SELECT COALESCE(SUM(delete_count), 0)::BIGINT
FROM ducklake_meta.ducklake_delete_file
WHERE table_id = getvariable('rewrite_inlined_delete_stats_table_id')
  AND end_snapshot IS NULL;
----
0

query I
SELECT COUNT(*) FROM rewrite_inlined_delete_stats;
----
100

query TII
SELECT table_name, files_processed, files_created
FROM ducklake_rewrite_data_files('ducklake', 'rewrite_inlined_delete_stats', delete_threshold => 0);
----
rewrite_inlined_delete_stats	1	1

query I
SELECT record_count
FROM ducklake_meta.ducklake_table_stats
WHERE table_id = getvariable('rewrite_inlined_delete_stats_table_id');
----
100

query I
SELECT COALESCE(SUM(record_count), 0)::BIGINT
FROM ducklake_meta.ducklake_data_file
WHERE table_id = getvariable('rewrite_inlined_delete_stats_table_id')
  AND end_snapshot IS NULL;
----
100

query I
SELECT COALESCE(SUM(delete_count), 0)::BIGINT
FROM ducklake_meta.ducklake_delete_file
WHERE table_id = getvariable('rewrite_inlined_delete_stats_table_id')
  AND end_snapshot IS NULL;
----
0

statement ok
SET VARIABLE rewrite_inlined_delete_stats_size = (
    SELECT file_size_bytes
    FROM ducklake_meta.ducklake_table_stats
    WHERE table_id = getvariable('rewrite_inlined_delete_stats_table_id')
)

query I
SELECT (COALESCE(SUM(file_size_bytes), 0)::BIGINT = getvariable('rewrite_inlined_delete_stats_size'))::INTEGER
FROM ducklake_meta.ducklake_data_file
WHERE table_id = getvariable('rewrite_inlined_delete_stats_table_id')
  AND end_snapshot IS NULL;
----
1

query I
SELECT COUNT(*) FROM rewrite_inlined_delete_stats;
----
100

statement ok
CREATE TABLE rewrite_zero_output_stats(i INTEGER);

statement ok
SET VARIABLE rewrite_zero_output_stats_table_id = (
    SELECT table_id
    FROM ducklake_meta.ducklake_table
    WHERE table_name = 'rewrite_zero_output_stats'
)

statement ok
INSERT INTO rewrite_zero_output_stats SELECT i::INTEGER FROM range(20) t(i);

statement ok
DELETE FROM rewrite_zero_output_stats WHERE i < 20;

statement ok
CALL ducklake_flush_inlined_data('ducklake');

query I
SELECT record_count
FROM ducklake_meta.ducklake_table_stats
WHERE table_id = getvariable('rewrite_zero_output_stats_table_id');
----
20

query I
SELECT COALESCE(SUM(record_count), 0)::BIGINT
FROM ducklake_meta.ducklake_data_file
WHERE table_id = getvariable('rewrite_zero_output_stats_table_id')
  AND end_snapshot IS NULL;
----
20

query I
SELECT COALESCE(SUM(delete_count), 0)::BIGINT
FROM ducklake_meta.ducklake_delete_file
WHERE table_id = getvariable('rewrite_zero_output_stats_table_id')
  AND end_snapshot IS NULL;
----
20

query I
SELECT COUNT(*) FROM rewrite_zero_output_stats;
----
0

query TII
SELECT table_name, files_processed, files_created
FROM ducklake_rewrite_data_files('ducklake', 'rewrite_zero_output_stats', delete_threshold => 0);
----
rewrite_zero_output_stats	1	0

query I
SELECT record_count
FROM ducklake_meta.ducklake_table_stats
WHERE table_id = getvariable('rewrite_zero_output_stats_table_id');
----
0

query I
SELECT COALESCE(SUM(record_count), 0)::BIGINT
FROM ducklake_meta.ducklake_data_file
WHERE table_id = getvariable('rewrite_zero_output_stats_table_id')
  AND end_snapshot IS NULL;
----
0

query I
SELECT COALESCE(SUM(delete_count), 0)::BIGINT
FROM ducklake_meta.ducklake_delete_file
WHERE table_id = getvariable('rewrite_zero_output_stats_table_id')
  AND end_snapshot IS NULL;
----
0

statement ok
SET VARIABLE rewrite_zero_output_stats_size = (
    SELECT file_size_bytes
    FROM ducklake_meta.ducklake_table_stats
    WHERE table_id = getvariable('rewrite_zero_output_stats_table_id')
)

query I
SELECT (COALESCE(SUM(file_size_bytes), 0)::BIGINT = getvariable('rewrite_zero_output_stats_size'))::INTEGER
FROM ducklake_meta.ducklake_data_file
WHERE table_id = getvariable('rewrite_zero_output_stats_table_id')
  AND end_snapshot IS NULL;
----
1

query I
SELECT COUNT(*) FROM rewrite_zero_output_stats;
----
0
